{
  "version": "v0.1",
  "updated": "2026-04-27",
  "description": "SiliWiki V1 使用说明中的核心术语。",
  "categories": [
    { "key": "core", "title": "核心概念", "color": "#a63d00" },
    { "key": "workflow", "title": "使用流程", "color": "#0b6e4f" },
    { "key": "system", "title": "系统组件", "color": "#1e4a7a" }
  ],
  "keywords": [
    {
      "slug": "siliwiki",
      "display": "SiliWiki",
      "aliases": ["硅基笔记", "SiliWiki / 硅基笔记"],
      "category": "core",
      "short": "本地优先的 Agent-generated Wiki Workbench。",
      "definition": "SiliWiki 是一套本地 Wiki UI、Agent 写作 skill、内容包规范和校验工具的组合。它让用户自己的本地 Agent 生成结构化 wiki/glossary 内容，并通过 localhost 阅读。",
      "related": ["wiki", "skill", "content-pack"],
      "sources": ["raw/sources.md#siliwiki-v1-design"]
    },
    {
      "slug": "wiki",
      "display": "Wiki",
      "aliases": ["本地 Wiki", "wiki 内容包"],
      "category": "core",
      "short": "一份可被 SiliWiki 渲染和长期维护的本地知识文件夹。",
      "definition": "在 SiliWiki 里，Wiki 是 content/wikis/<slug> 下的内容包，至少包含 meta.json 和 content.md，推荐包含 glossary.json 与 raw/sources.md。",
      "related": ["content-pack", "glossary"],
      "sources": ["raw/sources.md#siliwiki-v1-design"]
    },
    {
      "slug": "glossary",
      "display": "Glossary",
      "aliases": ["词条", "术语表", "canonical term registry", "概念压缩层"],
      "category": "core",
      "short": "统一术语、别名、定义、关联和来源的概念压缩层。",
      "definition": "Glossary 用来把一个主题中容易混乱的概念压缩为稳定 term，既服务读者理解，也服务未来 Agent 持续维护。",
      "related": ["wiki", "source-registry"],
      "sources": ["raw/sources.md#siliwiki-v1-design"]
    },
    {
      "slug": "skill",
      "display": "Skill",
      "aliases": ["Agent harness", "写作说明书", "内容说明书"],
      "category": "workflow",
      "short": "交给本地 Agent 的写作协议。",
      "definition": "Skill 规定 Agent 如何创建 SiliWiki 内容包、如何写 meta/content/glossary/sources、如何校验结果。它是从聊天输出到本地结构化文件的桥。",
      "related": ["siliwiki", "content-pack"],
      "sources": ["raw/sources.md#siliwiki-v1-design"]
    },
    {
      "slug": "content-pack",
      "display": "Content Pack",
      "aliases": ["内容包", "wiki folder", "本地内容包"],
      "category": "system",
      "short": "SiliWiki 的基本内容单位。",
      "definition": "Content Pack 是 content/wikis/<slug> 下的一组文件，包括 meta.json、content.md、可选 glossary.json、raw/sources.md 和 images/。",
      "related": ["wiki", "source-registry"],
      "sources": ["raw/sources.md#siliwiki-v1-design"]
    },
    {
      "slug": "source-registry",
      "display": "Source Registry",
      "aliases": ["来源登记", "raw/sources.md", "证据登记簿"],
      "category": "system",
      "short": "记录内容依据和待核实点的证据层。",
      "definition": "Source Registry 通常是 raw/sources.md，负责登记论文、链接、会议纪要、截图、数据等来源，避免 Agent 生成内容后无法追溯。",
      "related": ["glossary", "content-pack"],
      "sources": ["raw/sources.md#siliwiki-v1-design"]
    }
  ]
}
