{
  "version": "v0.2",
  "updated": "2026-04-27",
  "description": "Core terms for the self-evolving Agentic Wiki sample.",
  "categories": [
    {
      "key": "core",
      "title": "Core concepts",
      "color": "#5f7f90"
    },
    {
      "key": "memory",
      "title": "Agent memory",
      "color": "#7a5c9e"
    },
    {
      "key": "evidence",
      "title": "Evidence and review",
      "color": "#0b6e4f"
    }
  ],
  "keywords": [
    {
      "slug": "sili-loop",
      "display": "SiliLoop",
      "aliases": [
        "自进化循环"
      ],
      "category": "core",
      "short": "The observe → retrieve → reflect → plan → patch → validate loop.",
      "definition": "SiliLoop is the SiliWiki self-evolution loop that turns local wiki files into ranked memories, writes a reviewable plan, and validates changes before trust.",
      "related": [
        "memory-stream",
        "evolution-plan",
        "reflection"
      ],
      "sources": [
        "raw/sources.md#generative-agents",
        "raw/sources.md#reflexion"
      ]
    },
    {
      "slug": "memory-stream",
      "display": "Memory stream",
      "aliases": [
        "记忆流"
      ],
      "category": "memory",
      "short": "A ranked list of wiki facts, terms, sources, and gaps.",
      "definition": "A memory stream is the intermediate representation SiliWiki builds from content, glossary, sources, and structural gaps so an agent can retrieve the most useful next context.",
      "related": [
        "sili-loop",
        "reflection"
      ],
      "sources": [
        "raw/sources.md#generative-agents",
        "raw/sources.md#memgpt"
      ]
    },
    {
      "slug": "reflection",
      "display": "Reflection",
      "aliases": [
        "反思",
        "verbal reflection"
      ],
      "category": "memory",
      "short": "A written summary of what the next agent should notice.",
      "definition": "Reflection compresses high-signal memory entries into actionable observations, such as missing evidence or a glossary term that should be woven into the body.",
      "related": [
        "memory-stream",
        "evolution-plan"
      ],
      "sources": [
        "raw/sources.md#reflexion"
      ]
    },
    {
      "slug": "evolution-plan",
      "display": "Evolution plan",
      "aliases": [
        "自进化计划",
        "plan.md"
      ],
      "category": "core",
      "short": "A human-reviewable next-step plan for improving a wiki pack.",
      "definition": "An evolution plan is a Markdown report generated by `siliwiki evolve`; it lists metrics, reflections, planned actions, memory entries, references, and validation commands.",
      "related": [
        "sili-loop",
        "human-review"
      ],
      "sources": [
        "raw/sources.md#voyager",
        "raw/sources.md#self-rag"
      ]
    },
    {
      "slug": "glossary",
      "display": "Glossary",
      "aliases": [
        "词条表",
        "术语表"
      ],
      "category": "evidence",
      "short": "The canonical term layer for a wiki pack.",
      "definition": "The glossary defines important words, aliases, relationships, and source anchors so humans and agents reuse the same concepts consistently.",
      "related": [
        "memory-stream",
        "source-anchor"
      ],
      "sources": [
        "raw/sources.md#siliwiki-design"
      ]
    },
    {
      "slug": "source-anchor",
      "display": "Source anchor",
      "aliases": [
        "来源锚点"
      ],
      "category": "evidence",
      "short": "A stable link target inside raw/sources.md.",
      "definition": "A source anchor lets content and glossary entries point to the exact evidence record they depend on.",
      "related": [
        "glossary",
        "human-review"
      ],
      "sources": [
        "raw/sources.md#siliwiki-design"
      ]
    },
    {
      "slug": "human-review",
      "display": "Human review",
      "aliases": [
        "人工复查"
      ],
      "category": "evidence",
      "short": "The required trust boundary before accepting evolved content.",
      "definition": "Human review means the user checks meaning, evidence, and safety after the agent edits local files and before treating the result as final.",
      "related": [
        "evolution-plan",
        "source-anchor"
      ],
      "sources": [
        "raw/sources.md#self-rag"
      ]
    }
  ]
}
